<?xml version="1.0" encoding="UTF-8"?>
<clients xmlns:xsi="http://www.w3.org/2001/XMLSchema"
	xsi:noNamespaceSchemaLocation="downloadparam.xsd">
<!--  	<client>
		<url>http://www.huipinzhe.com/</url>
		<referer>http://www.huipinzhe.com/</referer>
		<method>GET</method>
		<urltype>category</urltype>
		<user_agent>Mozilla/5.0 (X11; Ubuntu; Linux x86_64; rv:47.0) Gecko/20100101 Firefox/47.0</user_agent>
		<cookie></cookie>
		<paserclass>HuiPinZheCategoryParse</paserclass>
	</client>  -->
 	<client>
		<url>http://www.zhe800.com/</url>
		<referer>http://www.zhe800.com</referer>
		<method>GET</method>
		<urltype>category</urltype>
		<user_agent>Mozilla/5.0 (X11; Ubuntu; Linux x86_64; rv:47.0) Gecko/20100101 Firefox/47.0</user_agent>
		<cookie></cookie>
		<paserclass>ZheBaBaiCategoryParse</paserclass>
	</client> 
</clients>